{
  "$schema": "https://json-schema.org/draft/2020-12/schema",
  "$id": "https://supercampus.ai/schemas/module-manifest.schema.json",
  "title": "SuperCampus frontend module manifest",
  "type": "object",
  "required": ["key", "name", "version", "frontendEntry", "permissions", "capabilities"],
  "properties": {
    "key": {
      "enum": ["academics", "admissions", "alumni", "analytics", "application-desk", "attendance", "communications", "counselling-wellness", "crm", "documents", "employee-self-service", "examinations", "feedback-grievance", "fees", "form-builder", "gatepass", "hostel", "library", "no-due", "parents-self-service", "placement", "repairs-maintenance", "roles-modules", "sick-room-medical-records", "student-onboarding", "student-self-service", "timetable", "transport", "vendor-management", "visitor-management"]
    },
    "name": { "type": "string", "minLength": 1 },
    "version": { "type": "string", "pattern": "^[0-9]+\\.[0-9]+\\.[0-9]+$" },
    "frontendEntry": { "type": "string", "minLength": 1 },
    "permissions": { "type": "array", "items": { "type": "string" }, "uniqueItems": true },
    "capabilities": { "type": "array", "items": { "type": "string" }, "uniqueItems": true }
  },
  "additionalProperties": false
}
