{
    "$schema":  "../../contracts/module-manifest.schema.json",
    "key":  "transport",
    "name":  "Transport",
    "version":  "0.1.0",
    "frontendEntry":  "./src/index.ts",
    "permissions":  [
                        "transport.read",
                        "transport.create",
                        "transport.update",
                        "transport.configure",
                        "transport.reports.read"
                    ],
    "capabilities":  [
                         "routes",
                         "vehicles",
                         "stops",
                         "assignments",
                         "tracking",
                         "maintenance"
                     ]
}
