{
    "$schema":  "../../contracts/module-manifest.schema.json",
    "key":  "employee-self-service",
    "name":  "Employee Self Service",
    "version":  "0.1.0",
    "frontendEntry":  "./src/index.ts",
    "permissions":  [
                        "employee-self-service.read",
                        "employee-self-service.create",
                        "employee-self-service.update",
                        "employee-self-service.delete",
                        "employee-self-service.configure",
                        "employee-self-service.reports.read"
                    ],
    "capabilities":  [
                         "profile",
                         "leave",
                         "payroll",
                         "documents",
                         "requests"
                     ]
}
