{
  "$schema": "../../contracts/module-manifest.schema.json",
  "key": "application-desk",
  "name": "Application Desk",
  "version": "0.1.0",
  "frontendEntry": "./src/index.ts",
  "permissions": [
    "application-desk.view",
    "application-desk.create",
    "application-desk.edit",
    "application-desk.verify",
    "application-desk.assign",
    "application-desk.approve",
    "application-desk.reject",
    "application-desk.hold",
    "application-desk.resume",
    "application-desk.activate",
    "application-desk.manage_settings",
    "application-desk.reports.read"
  ],
  "capabilities": [
    "admission-handoff",
    "onboarding-orchestration",
    "identity-resolution",
    "document-verification",
    "academic-mapping",
    "section-allocation",
    "finance-verification",
    "approval-chain",
    "student-number-generation",
    "student-provisioning",
    "access-provisioning"
  ]
}
