{
    "$schema":  "../../contracts/module-manifest.schema.json",
    "key":  "hostel",
    "name":  "Hostel",
    "version":  "0.1.0",
    "frontendEntry":  "./src/index.ts",
    "permissions":  [
                        "hostel.read",
                        "hostel.create",
                        "hostel.update",
                        "hostel.configure",
                        "hostel.reports.read"
                    ],
    "capabilities":  [
                         "buildings",
                         "rooms",
                         "allocations",
                         "residents",
                         "visitors",
                         "maintenance"
                     ]
}
