{
    "$schema":  "../../contracts/module-manifest.schema.json",
    "key":  "gatepass",
    "name":  "Gate Pass",
    "version":  "0.1.0",
    "frontendEntry":  "./src/index.ts",
    "permissions":  [
                        "gatepass.read",
                        "gatepass.create",
                        "gatepass.update",
                        "gatepass.configure",
                        "gatepass.reports.read"
                    ],
    "capabilities":  [
                         "passes",
                         "approvals",
                         "qr",
                         "scans",
                         "geofences",
                         "overrides"
                     ]
}
