{
    "$schema":  "../../contracts/module-manifest.schema.json",
    "key":  "documents",
    "name":  "Documents",
    "version":  "0.1.0",
    "frontendEntry":  "./src/index.ts",
    "permissions":  [
                        "documents.read",
                        "documents.create",
                        "documents.update",
                        "documents.configure",
                        "documents.reports.read"
                    ],
    "capabilities":  [
                         "files",
                         "folders",
                         "templates",
                         "verification",
                         "retention"
                     ]
}
