{
    "$schema":  "../../contracts/module-manifest.schema.json",
    "key":  "examinations",
    "name":  "Examinations",
    "version":  "0.1.0",
    "frontendEntry":  "./src/index.ts",
    "permissions":  [
                        "examinations.read",
                        "examinations.create",
                        "examinations.update",
                        "examinations.configure",
                        "examinations.reports.read"
                    ],
    "capabilities":  [
                         "assessments",
                         "schedules",
                         "grading",
                         "results",
                         "transcripts"
                     ]
}
