{
    "$schema":  "../../contracts/module-manifest.schema.json",
    "key":  "fees",
    "name":  "Fees",
    "version":  "0.1.0",
    "frontendEntry":  "./src/index.ts",
    "permissions":  [
                        "fees.read",
                        "fees.create",
                        "fees.update",
                        "fees.configure",
                        "fees.reports.read"
                    ],
    "capabilities":  [
                         "fee-plans",
                         "invoices",
                         "payments",
                         "refunds",
                         "scholarships",
                         "reports"
                     ]
}
