{
    "$schema":  "../../contracts/module-manifest.schema.json",
    "key":  "library",
    "name":  "Library",
    "version":  "0.1.0",
    "frontendEntry":  "./src/index.ts",
    "permissions":  [
                        "library.read",
                        "library.create",
                        "library.update",
                        "library.configure",
                        "library.reports.read"
                    ],
    "capabilities":  [
                         "catalog",
                         "copies",
                         "loans",
                         "holds",
                         "members",
                         "fines"
                     ]
}
