{
    "$schema":  "../../contracts/module-manifest.schema.json",
    "key":  "roles-modules",
    "name":  "Roles and Modules",
    "version":  "0.1.0",
    "frontendEntry":  "./src/index.ts",
    "permissions":  [
                        "roles-modules.read",
                        "roles-modules.create",
                        "roles-modules.update",
                        "roles-modules.delete",
                        "roles-modules.configure",
                        "roles-modules.reports.read"
                    ],
    "capabilities":  [
                         "roles",
                         "modules",
                         "features",
                         "crud-permissions",
                         "user-assignment"
                     ]
}
